{
  "colors": {
    "primary": "#6366f1",
    "secondary": "#10b981",
    "accent": "#f43f5e",
    "neutral": "#6b7280",
    "semantic": {
      "success": "#22c55e",
      "warning": "#eab308",
      "error": "#ef4444",
      "info": "#3b82f6"
    }
  },
  "typography": {
    "font_families": {
      "body": "Inter, system-ui, sans-serif",
      "heading": "Outfit, system-ui, sans-serif",
      "code": "Fira Code, monospace"
    },
    "font_sizes": {
      "xs": "0.75rem",
      "sm": "0.875rem",
      "base": "1rem",
      "lg": "1.125rem",
      "xl": "1.25rem",
      "2xl": "1.5rem",
      "3xl": "1.875rem",
      "4xl": "2.25rem"
    },
    "font_weights": {
      "light": "300",
      "regular": "400",
      "medium": "500",
      "bold": "700"
    },
    "line_heights": {
      "tight": "1.25",
      "normal": "1.5",
      "loose": "2"
    }
  },
  "spacing": {
    "none": "0px",
    "xs": "4px",
    "sm": "8px",
    "md": "16px",
    "lg": "24px",
    "xl": "32px",
    "2xl": "48px",
    "3xl": "64px"
  },
  "radii": {
    "none": "0px",
    "sm": "4px",
    "md": "8px",
    "lg": "12px",
    "full": "9999px"
  },
  "shadows": {
    "none": "none",
    "sm": "0 1px 2px 0 rgba(0, 0, 0, 0.05)",
    "md": "0 4px 6px -1px rgba(0, 0, 0, 0.1), 0 2px 4px -1px rgba(0, 0, 0, 0.06)",
    "lg": "0 10px 15px -3px rgba(0, 0, 0, 0.1), 0 4px 6px -2px rgba(0, 0, 0, 0.05)",
    "xl": "0 20px 25px -5px rgba(0, 0, 0, 0.1), 0 10px 10px -5px rgba(0, 0, 0, 0.04)"
  },
  "animations": {
    "fade": "fade 0.2s ease-in-out",
    "spin": "spin 1s linear infinite",
    "slide": "slide 0.3s ease-out"
  }
}
